{
  "envelope_version": "1.0",
  "graph_id": "cg_subjects_bundle_resolved",
  "graph_family": "semantic",
  "graph_revision": 0,
  "parent_revision": null,
  "producer": {
    "system": "S1",
    "functioning": "functioning://S1/GRAPH.CONSTRUCTION",
    "version": "0.3.0-draft.6",
    "runtime_profile": "standard"
  },
  "temporal_anchor": "2026-10-06T08:31:28Z",
  "payload_schema": "schema://S1/context-graph/1.0",
  "payload": {
    "nodes": [
      {
        "id": "node_source_graph",
        "label": "Source Graph",
        "type": "artifact",
        "epistemic_state": "source",
        "salience": 0.9,
        "activation": 0.74,
        "confidence": {
          "value": 1.0,
          "method": "rule-derived",
          "calibration_ref": null,
          "explanation_code": "EXPLICIT_SUBJECT"
        },
        "provenance": [
          {
            "provenance_id": "prov-f29702cd8e39ed55",
            "source_id": "test-prompt-2026-10-06",
            "block_id": "subject-set",
            "span": null,
            "span_unavailable_reason": "whole_block_semantic_reference",
            "producer_id": "S1.CANDIDATE.PROPOSAL",
            "transformation_chain": []
          }
        ],
        "temporal": null,
        "domains": [
          "provenance",
          "data-ingestion"
        ],
        "attributes": {
          "role": "evidence-bearing source topology"
        }
      },
      {
        "id": "node_memory_of_loci",
        "label": "Memory of Loci",
        "type": "concept",
        "epistemic_state": "source",
        "salience": 0.82,
        "activation": 0.68,
        "confidence": {
          "value": 1.0,
          "method": "rule-derived",
          "calibration_ref": null,
          "explanation_code": "EXPLICIT_SUBJECT"
        },
        "provenance": [
          {
            "provenance_id": "prov-f29702cd8e39ed55",
            "source_id": "test-prompt-2026-10-06",
            "block_id": "subject-set",
            "span": null,
            "span_unavailable_reason": "whole_block_semantic_reference",
            "producer_id": "S1.CANDIDATE.PROPOSAL",
            "transformation_chain": []
          }
        ],
        "temporal": null,
        "domains": [
          "mnemonics",
          "spatial-memory"
        ],
        "attributes": {
          "role": "spatial retrieval and positional anchoring paradigm"
        }
      },
      {
        "id": "node_cognitive_mapping",
        "label": "Cognitive Mapping",
        "type": "system",
        "epistemic_state": "source",
        "salience": 0.98,
        "activation": 0.92,
        "confidence": {
          "value": 1.0,
          "method": "rule-derived",
          "calibration_ref": null,
          "explanation_code": "EXPLICIT_SUBJECT"
        },
        "provenance": [
          {
            "provenance_id": "prov-f29702cd8e39ed55",
            "source_id": "test-prompt-2026-10-06",
            "block_id": "subject-set",
            "span": null,
            "span_unavailable_reason": "whole_block_semantic_reference",
            "producer_id": "S1.CANDIDATE.PROPOSAL",
            "transformation_chain": []
          }
        ],
        "temporal": null,
        "domains": [
          "system-os",
          "cognitive-architecture"
        ],
        "attributes": {
          "role": "construct and maintain typed evidence-aware context graphs"
        }
      },
      {
        "id": "node_model_context",
        "label": "Model Context",
        "type": "artifact",
        "epistemic_state": "source",
        "salience": 0.92,
        "activation": 0.86,
        "confidence": {
          "value": 1.0,
          "method": "rule-derived",
          "calibration_ref": null,
          "explanation_code": "EXPLICIT_SUBJECT"
        },
        "provenance": [
          {
            "provenance_id": "prov-f29702cd8e39ed55",
            "source_id": "test-prompt-2026-10-06",
            "block_id": "subject-set",
            "span": null,
            "span_unavailable_reason": "whole_block_semantic_reference",
            "producer_id": "S1.CANDIDATE.PROPOSAL",
            "transformation_chain": []
          }
        ],
        "temporal": null,
        "domains": [
          "runtime-execution",
          "context-window"
        ],
        "attributes": {
          "role": "active information state available to the model"
        }
      },
      {
        "id": "node_candidate_graph",
        "label": "Candidate Graph",
        "type": "artifact",
        "epistemic_state": "source",
        "salience": 0.88,
        "activation": 0.7,
        "confidence": {
          "value": 0.98,
          "method": "rule-derived",
          "calibration_ref": null,
          "explanation_code": "EXPLICIT_SUBJECT"
        },
        "provenance": [
          {
            "provenance_id": "prov-bee5f0bde7943f51",
            "source_id": "System1_Cognitive_Mapping_Full_Implementation_Spec_v0.3.0-draft.6.md",
            "block_id": "artifact_model",
            "span": null,
            "span_unavailable_reason": "whole_block_semantic_reference",
            "producer_id": "S1.CANDIDATE.PROPOSAL",
            "transformation_chain": [
              "bundle://system1/0.3.0-draft.6"
            ]
          }
        ],
        "temporal": null,
        "domains": [
          "admission",
          "staging"
        ],
        "attributes": {
          "role": "provisional staging state"
        }
      },
      {
        "id": "node_context_graph",
        "label": "Canonical Context Graph",
        "type": "artifact",
        "epistemic_state": "source",
        "salience": 0.96,
        "activation": 0.88,
        "confidence": {
          "value": 1.0,
          "method": "rule-derived",
          "calibration_ref": null,
          "explanation_code": "EXPLICIT_SUBJECT"
        },
        "provenance": [
          {
            "provenance_id": "prov-bee5f0bde7943f51",
            "source_id": "System1_Cognitive_Mapping_Full_Implementation_Spec_v0.3.0-draft.6.md",
            "block_id": "artifact_model",
            "span": null,
            "span_unavailable_reason": "whole_block_semantic_reference",
            "producer_id": "S1.CANDIDATE.PROPOSAL",
            "transformation_chain": [
              "bundle://system1/0.3.0-draft.6"
            ]
          }
        ],
        "temporal": null,
        "domains": [
          "canonical-state"
        ],
        "attributes": {
          "role": "validated machine-readable situational state"
        }
      },
      {
        "id": "node_temporal_anchor",
        "label": "Temporal Anchor",
        "type": "temporal-marker",
        "epistemic_state": "source",
        "salience": 0.76,
        "activation": 0.55,
        "confidence": {
          "value": 1.0,
          "method": "rule-derived",
          "calibration_ref": null,
          "explanation_code": "EXPLICIT_SUBJECT"
        },
        "provenance": [
          {
            "provenance_id": "prov-bee5f0bde7943f51",
            "source_id": "System1_Cognitive_Mapping_Full_Implementation_Spec_v0.3.0-draft.6.md",
            "block_id": "artifact_model",
            "span": null,
            "span_unavailable_reason": "whole_block_semantic_reference",
            "producer_id": "S1.CANDIDATE.PROPOSAL",
            "transformation_chain": [
              "bundle://system1/0.3.0-draft.6"
            ]
          }
        ],
        "temporal": null,
        "domains": [
          "temporal-context"
        ],
        "attributes": {
          "role": "revision-time reference"
        }
      },
      {
        "id": "node_graph_envelope",
        "label": "Graph Envelope",
        "type": "artifact",
        "epistemic_state": "source",
        "salience": 0.9,
        "activation": 0.78,
        "confidence": {
          "value": 1.0,
          "method": "rule-derived",
          "calibration_ref": null,
          "explanation_code": "EXPLICIT_SUBJECT"
        },
        "provenance": [
          {
            "provenance_id": "prov-bee5f0bde7943f51",
            "source_id": "System1_Cognitive_Mapping_Full_Implementation_Spec_v0.3.0-draft.6.md",
            "block_id": "artifact_model",
            "span": null,
            "span_unavailable_reason": "whole_block_semantic_reference",
            "producer_id": "S1.CANDIDATE.PROPOSAL",
            "transformation_chain": [
              "bundle://system1/0.3.0-draft.6"
            ]
          }
        ],
        "temporal": null,
        "domains": [
          "transport",
          "schema"
        ],
        "attributes": {
          "schema_ref": "schema://S1/graph-envelope/1.0"
        }
      }
    ],
    "edges": [
      {
        "id": "edge_source_graph_supports_cognitive_mapping",
        "source": "node_source_graph",
        "target": "node_cognitive_mapping",
        "relation": "supports",
        "weight": 0.94,
        "confidence": {
          "value": 0.9,
          "method": "heuristic",
          "calibration_ref": null,
          "explanation_code": "SOURCE_TO_MAP_PIPELINE"
        },
        "epistemic_state": "inferred",
        "provenance": [
          {
            "provenance_id": "prov-7e49cd58a78fd295",
            "source_id": "System1_Cognitive_Mapping_Full_Implementation_Spec_v0.3.0-draft.6.md",
            "block_id": "sec_5",
            "span": null,
            "span_unavailable_reason": "whole_block_semantic_reference",
            "producer_id": "S1.CANDIDATE.PROPOSAL",
            "transformation_chain": []
          }
        ],
        "temporal": null,
        "attributes": {
          "semantics": "Source structure supplies evidence-bearing input to mapping."
        }
      },
      {
        "id": "edge_cognitive_mapping_influences_model_context",
        "source": "node_cognitive_mapping",
        "target": "node_model_context",
        "relation": "influences",
        "weight": 0.97,
        "confidence": {